0	2022-10-25 14:03:00+00:00	daisyenergyca	3 Reasons For/Against Solar Panel Installation  #greenenergy #energymanagement #energyefficiency #solarenergy #energysavingsolutions #energyinnovation #energyservicespecialist #energymanagementsolution #reduceenergy #energycost #solarenergy #solarenergysystem #energysaving	Neutral
392	2020-08-02 19:40:02+00:00	rtoinsider	The third time’s a #charm for getting approval of its sweeping, cost-allocation #overhaul for large #economic transmission projects. | by #NEWS #energycost #energynews #energy #MISO #renewableenergy #energyapproval #repost	Positive
393	2020-07-30 17:45:04+00:00	rtoinsider	The third time’s a #charm for getting approval of its sweeping, cost-allocation #overhaul for large #economic transmission projects. | by #NEWS #energycost #energynews #energy #MISO #renewableenergy #energyapproval #approval	Positive
394	2020-07-30 09:00:03+00:00	MADECORESS	Please Call/WhatsApp: 0702 5000 959 / Email: contact@madecoresolar.com for further enquiries   #Ramadan #energytransition #energycost #solarpower #electricitybill #solarenergy #keepTheLightsOn #renewableenergy #sustainableenergy #lagos #lekki #nigerian	Positive
395	2020-07-28 15:00:58+00:00	PowerAfricaUS	.@USAID launched their #REAuctionToolkit to help partner countries design and implement #energyauctions that dramatically reduce #energycost, increase transparency, and facilitate #privatesectorinvestment ➡️ http  #RECompetes	Positive
396	2020-07-27 07:05:16+00:00	EnlitAustralia	In an article by has entered into investment and framework agreements with BECIS. Together, they will provide customers access to #distributedenergysolutions and address #energycost and #sustainability challenges.  Read the article:	Positive
397	2020-07-23 10:15:00+00:00	dexma	[Webinar Recording] 🎥 Get actionable tips to forecast your energy cost. Learn about top technologies to automate forecasting tasks and be a more productive energy manager: 👉    #EnergyManagement #EnergyEfficiency #EnergyCost	Positive
398	2020-07-23 08:01:54+00:00	MADECORESS	Please Call/WhatsApp: 0702 5000 959 / Email: contact@madecoresolar.com for more enquiries on #energyconservation  #Power20in2020 #Thursdaymorning #energyefficiency #energycost #energysavings #solarpower #solarenergy #renewableenergy #sustainableenergy #lekki #lagos #nigeria	Positive
399	2020-07-21 03:50:13+00:00	AlviTechnologie	Dynamic #filtermonitoring #fischerproline #DE90 #diffrentialpressuretransmitter display filter contamination #filtercontamination saving #energycost #filtercost with #temperaruremonitoring #humiditymonitoring and #airquality 	Positive
400	2020-07-15 08:09:52+00:00	MADECORESS	Choose MadeCore when adding #SolarStorage to your existing #Power Infrastructure.  #keepTheLightsOn #quality #energystorage #energycost #electricitybill #solarworks #energyefficiency #energyharvest #lagos #lekki #nigeria	Neutral
401	2020-07-05 12:25:56+00:00	LuxTechSchool	Team Six #SpaceY, on the development of #solar panels rental and investment in #green energy.  #SunInvest #reduction #energycost #rooftop	Positive
402	2020-07-02 09:08:49+00:00	criticalpowerEA	Looking to save your business' energy consumption? At #criticalpower, we have ways to help you reduce your usage and save you money using our quality #rectifier brands.   Vist: http  Call +254722766655  #energycost #savemoney #EastAfrica #Kenya #Enatel	Positive
403	2020-06-23 23:15:00+00:00	Jenifer_MedIns	With summer comes summer weather and air conditioning. If you're looking to save on your electric bill this summer, you've got to see these suggestions at http  #summer #summerheat #energycost #savingstips #SeniorSolutionsUSAJeniferPattersonMedicareInsurance	Positive
404	2020-06-20 15:54:06+00:00	fmtoday	Yeo Bee Yin says global energy costs have dropped in the past three months. #FMTNews #TNB #Rebate #EnergyCost 	Positive
405	2020-06-18 14:01:17+00:00	FeedItGreen	Here's a throwback pic of Hillside High sports hall. We were tasked with improving the energy consumption of the school by  http   #ledlighting #energy #lowcost #sefton #liverpool #school #lighting #energycost #savemoney #throwback #greenenergy	Positive
406	2020-06-03 10:31:01+00:00	BevyWise	#tip of the week - 49  Is your Industrial #energy bill gives you a rude shock?  Cut down the industrial #energycost by 15% with an #IoT based energy management solution.  #iiot #energyefficiency #iotapplications #applications #Industry40 #industry #savecost #savemoney #ROI	Negative
407	2020-05-21 12:30:42+00:00	igsithaca	In 2019, there were more than 71 gigawatts (GW) of solar installed in the U.S., but is solar energy really worth it? Let's find out! http #renewables #incentives #rebates #taxcredit #homevalue #gogreen #gosolar #energycost #California #NewYork #Florida #solar	Positive
408	2020-05-06 03:47:51+00:00	inkpotion2	Summer is coming, will you be prepared for the heat? #savings #Utilities #utility #energysavingtips #energycost #energyefficiency #consumer #consumers http	Positive
409	2020-05-05 06:01:12+00:00	LeOSConsulting	As of 2020, #SaudiArabia has low #oil producing operating costs of just $3.20 a #barrel, about one-third of #America’s. Rystad Energy #energycost #fossilfuels	Neutral
410	2020-05-04 01:16:02+00:00	Sustain_Matters	Plan for drinking recycled wastewater Read more http  #industrynews #latestarticles #study #plan #research #comprehensivemodel #recycle #wastewater #waaterdelivery #surfacewater #energycost #sustainability #advancedpurificationsystems	Neutral
411	2020-04-30 19:40:07+00:00	cre_ron	.New HVAC start up gains investors in its BrainBox #AI claiming they can reduce energy costs by up to 25%. #startup #energycost #CRE #HighDesert #InlandEmpire #RealEstate #land #investments #development #industrial	Positive
412	2020-04-15 01:57:04+00:00	towandaism	"Eric Thomas | ""Charge"" Video | The Prescription Album via #inspiration #motivation #charge #TimeCost #EnergyCost"	Positive
413	2020-03-27 18:36:14+00:00	SBundscherer	Nikos is right: #energytransition cannot fight the virus, but sustainable economies would definitely be more #resilient to deal with #COVID19’s consequences, in many ways. #energycost #publichealth #diesel #airpollution #supplychains #regional production	Positive
414	2020-03-11 19:12:51+00:00	CoastTec	Most of the previous work focus on reducing the #energy #consumption of #ITequipment; however, the #power losses caused by an #uninterruptiblepowersupply (#UPS) is not considered, which could account for 15% of the total #energycost of a #datacenter.	Negative
415	2020-03-03 18:15:00+00:00	GoodEnergyUS	We help Fortune 1000 companies and major industrial #manufacturers on #energycost- offering time-saving measures related to energy cost analysis and #procurement customers. http #energyefficiency #communityenergyaggregation	Positive
416	2020-02-23 19:04:13+00:00	JohnnyDirectAIR	5 Tips To Sustain #EnergyCost Control Efforts from - #Manufacturing plants using #DirectAIR cut their #compressedair #energy costs and ALWAYS know how much they're using. #PlantManager	Neutral
417	2020-02-13 08:40:05+00:00	Subliminal73	President the voters here in #Virginia need a little help, Gov. Northam and his army of Socialist Dems want to Pollute Our Air &amp; Water Here by Closing the Only #CleanCoal Plant in #SWVA. This will also kill #Jobs and Increase #EnergyCost: #VAsen #VApol	Negative
418	2020-01-31 15:25:04+00:00	1TropicalHVAC	You’ve seen this label ⚠️before on most appliances at the store. Here is a quick guide on what each piece of information means to your #energycost @ Tropical Heating &amp; Air	Neutral
419	2020-01-31 15:05:05+00:00	SBojinski	35 Energy Efficiency Upgrades To Cut Your Energy Costs: A complete guide on how energy-efficient upgrades will help you save energy and reduce your energy costs.  http  #home #realtor #energycost #savingenergy	Positive
420	2020-01-29 17:32:06+00:00	GroupOlympus	Is your house letting in some drafts? Sealing cracks, gaps, leaks, and adding insulation can save up to 10% on home heating and cooling costs. #saveenergycosts #energycost	Positive
421	2020-01-20 18:09:01+00:00	springpowergas	Weatherwatch: high pressure on winter electricity supplies http #weather #weatherwatch #winter #coldweather #climate #electricity #electricitysupply #energydemand #energyprice #energycost #energy #energyindustry #energyoutlook #energymarket #environment #eco	Neutral
422	2020-01-19 19:30:01+00:00	CCC_Liebert	Save up to 30% on annual #energycost and 28% on room upgrades with Vertiv’s SmartRow DCX. Explore its comprehensive features on our site:	Positive
423	2020-01-15 20:01:40+00:00	AccessIncACSI	Save up to 30% on annual #energycost and 28% on room upgrades with Vertiv’s SmartRow DCX.   Explore its comprehensive features on our site:	Positive
424	2020-01-14 23:01:23+00:00	AccentWindows	How to reduce energy costs with your home’s doors and windows  Read More: http  #accent #accentaluminiumwindows #aluminiumwindows #aluminiumdoors #windows #doors #ratings #energyratings #efficiency #energycost #effcientwindows #effcientdoors	Positive
425	2020-01-10 19:19:05+00:00	ForwardMortgage	In honor of #NationalCutYourEnergyCostsDay ⏩ Here are some tips to cut your energy costs:  #energyefficiency #energy #energycost #saveenergy	Positive
426	2020-01-10 18:08:57+00:00	JeffGordonSales	Cut #EnergyCost this year with the #Bolt!	Negative
427	2020-01-10 17:28:13+00:00	Joshuafcook	National Cut Your Energy Costs Day #energycost Joshua Cook  Broker Associate #01976268 MikkiMoves Real Estate 707-440-9251 http	Neutral
428	2020-01-09 07:15:40+00:00	kynohk	Wonder if anyone has updated figures? #energycost	Neutral
429	2019-12-30 15:00:02+00:00	puranovacorp	#Shadingsystems  #Shades can reduce heat, glare &amp; #energycost! Manage natural light for #energy savings with automatic motorized shades, which can be programmed to rise &amp; lower to keep #lighting &amp; #temperature at #optimum levels. Did you know there is more	Positive
430	2019-12-09 14:32:11+00:00	CannabisReportr	Growers - If you’re going to #MJBizCon, visit Blue Mountain Energy's booth, #C8830, to learn how they can cut HVAC costs by 80%. http #hemp #cannabis #cbd #HVAC #energy #energycost #thecannabisreporter	Neutral
431	2019-12-03 12:38:22+00:00	EnergyforYu	Have you considered installing an EV chargepoint at your workplace?  Read more about the benefits, costs and Government schemes:  #ElectricVehicle #EnergyCost #chargepoints #workplace	Positive
432	2019-12-01 18:00:11+00:00	ISHNmag	Still haven't converted your facility (&amp; your home) to LED lighting? Here's why you should: http  #environment #LEDlighting #energycost #savingmoney #energyefficiency	Neutral
433	2019-11-29 15:09:17+00:00	mohammad_mahaki	Nice experience with presenting my #posters in 2019 at University of #Groningen.  #gait #stability #soccer #vo2max #energycost #recovery #lateralstabilization #newsetup	Positive
434	2019-11-28 15:00:03+00:00	puranovacorp	#Shadingsystems  #Shades can reduce heat, glare &amp; #energycost! Manage natural light for #energy savings with automatic motorized shades, which can be programmed to rise &amp; lower to keep #lighting &amp; #temperature at #optimum levels. Did you know there is more	Positive
435	2019-11-21 15:23:32+00:00	stahtup	Yes .. single use plastic is the worst thing we could be doing right now, but sustainability products come at a very high #Energycost and only if we solve that problem are we addressing the issue correctly #AlternateisExpensive today? #cheaperways to manufacture goods	Negative
436	2019-11-18 11:00:49+00:00	energies_mdpi	#mdpienergies How Expensive Is Expensive Enough? Opportunities for Cost Reductions in Offshore Wind Energy Logistics #OffshoreWind #EnergyCost	Positive
437	2019-11-15 23:01:24+00:00	ISPGR	#MultipleSclerosis and #EnergyCost of gait: Does it depend on fall status?  http	Neutral
438	2019-10-30 16:35:48+00:00	BatResearch	Male long-distance migrant turned sedentary; The West European pond bat (Myotis dasycneme) alters their migration and hibernation behaviour. PLoS One. 2019 Oct 28;14(10):e0217810 #batpapers #batweek  #choices #energycost	Neutral
439	2019-10-30 15:00:01+00:00	puranovacorp	#Shadingsystems  #Shades can reduce heat, glare &amp; #energycost! Manage natural light for #energy savings with automatic motorized shades, which can be programmed to rise &amp; lower to keep #lighting &amp; #temperature at #optimum levels. Did you know there is more	Positive
440	2019-10-29 10:58:40+00:00	SmartEnergyTV	achieves 100% scores in 4 of Getting Electricity indicators. #innovation  #energytransition #customerservices #poweroutages #energycost. Learn more about  the development here	Positive
441	2019-10-22 16:19:26+00:00	WhatWeValue	"""Despite a practically limitless supply of seawater, #desalinated #water still accounts for about 1% of the world’s fresh water."" As our seas rise and #waterscarcity increases, plus unexpected future bonus of #mineral capture, once #energycost decreases: http"	Positive
442	2019-10-07 08:28:10+00:00	rbamert	"""You can create something which looks cosmetically similar to Bitcoin, but you cannot replicate the settlement assurances which derive from the costliness of the ledger."" #energycost #computingcost #trust"	Positive
443	2019-10-03 08:52:44+00:00	EliGiannelli	Replying to on role of gas (again) -&gt; several #gas infrastructure projects will be financed by CEF &amp; should be in line with EU energy policy.   👍 very good reply on building renovation to address #EnergyCost	Positive
444	2019-09-24 15:00:06+00:00	puranovacorp	#Shadingsystems  #Shades can reduce heat, glare &amp; #energycost! Manage natural light for #energy savings with automatic motorized shades, which can be programmed to rise &amp; lower to keep #lighting &amp; #temperature at #optimum levels. Did you know there is more	Positive
445	2019-09-23 05:04:39+00:00	EcoAluminium	E66 #SunShadingSystem Designed to provide effective #sunprotection, boost #energyefficiency and enable #interiorcontrol of the natural night. E66 features ensure the comfort of building inhabitants, as well as a #decrease in #energycost. #ecoaluminiumaustralia #aluminium	Positive
446	2019-08-29 15:00:02+00:00	puranovacorp	#Shadingsystems  #Shades can reduce heat, glare &amp; #energycost! Manage natural light for #energy savings with automatic motorized shades, which can be programmed to rise &amp; lower to keep #lighting &amp; #temperature at #optimum levels. Did you know there is more	Positive
447	2019-08-26 06:37:20+00:00	economic_helen	3 Benefits of a Business Savings Account.https://t.co/fEA5Tgc2zC #BusinessSaving #Energysaving #Energycost #tipstricks #Businesssaving #Reduceenergycost #Commercialenergy #Businesssenergy #Energy #Utilitysaving #BusinessNRG #BusinessEnergyAudit #Energyefficiency	Positive
448	2019-08-23 08:10:21+00:00	mobileappsquare	Summer Electricity Bill: Every Household Headache  #EnergyManagement #energyCost http	Neutral
449	2019-08-23 08:10:20+00:00	WhizNets	Summer Electricity Bill: Every Household Headache  #EnergyManagement #energyCost http	Neutral
450	2019-08-18 17:16:50+00:00	MoneyIsGood9	"""Power lines that carry wind or solar power have to be sized to carry the maximum output, but the average output is about 1/3rd of the maximum output. The result is that the power line is expensive for the amount of power it actually transports"" -Dumb Energy by Rogers #energycost"	Negative
451	2019-08-18 01:52:58+00:00	likeabletoo	The #solar #energy revolution: storage and the #battery - #energygrid #windpower #solarpower #renewables #renewableenergy #energycost #fossilfuel #utilities #lowerenergycost #GreenNewDeal #GND #sustainable #environment #ClimateEmergency #GlobalHeating	Positive
452	2019-08-17 08:28:48+00:00	HPN64	Cisco CIO Says Shift to Cloud Will Cut Energy Use, Costs - WSJ #Cloud #energycost 	Neutral
453	2019-08-08 02:00:00+00:00	KingspanIns_AU	Poorly insulated homes in Australia are causing an increase in energy costs &amp; adverse health conditions of occupants. The #building industry is calling for more stringent energy standards to be adopted: #energyefficiency #energycost #insulation #home	Positive
454	2019-08-07 18:17:49+00:00	N5Dave	Lucifi, The Wi-Fi Smart Outdoor Light Reinvented #Lucifi #WiFi #Smart #Outdoor #Light #security #comfort #energycost #Schedules #install #phone	Positive
455	2019-08-05 12:15:04+00:00	energy_astral	Energy efficiency and reducing energy demand can be the cheapest and most effective ways to reduce carbon emissions. They are an important fuel of the future because the cheapest energy is the one you don't use.  #energy #energyefficiency #energycost #energysource	Positive
456	2019-08-02 12:25:05+00:00	TopOnlineTool	Worried about high electricity bills? Here are some useful tips to reduce your electricity bills! Save electricity!  http #electricitybills #electricity #energy #saveenergy #electricitybillcalculator #electricitycostcalculator #energycost #solarpanels	Positive
457	2019-07-30 15:00:02+00:00	puranovacorp	#Shadingsystems  #Shades can reduce heat, glare &amp; #energycost! Manage natural light for #energy savings with automatic motorized shades, which can be programmed to rise &amp; lower to keep #lighting &amp; #temperature at #optimum levels. Did you know there is more	Positive
458	2019-07-07 13:01:00+00:00	EdpRenewables	Cost competitiveness is key for renewable energy #RenewableEnergy #GreenEnergy #EnergyCost  http	Positive
459	2019-07-05 16:28:36+00:00	JournalInquirer	Conn. leads the nation in energy costs via #ctnews #CTenergy #energycost	Positive
460	2019-07-03 19:30:00+00:00	UsajRealty	2019’s Most &amp; Least Energy-Expensive States | #Denver #Denverneighborhood #Colorado #energy #homecosts #homeowner #homepurchase #energycost #Colorado#1 #electricity #heating #naturalgas #HVAC #airconditioning #utilities #homeoperatingcosts	Positive
461	2019-06-25 15:00:05+00:00	puranovacorp	#Shadingsystems  #Shades can reduce heat, glare &amp; #energycost! Manage natural light for #energy savings with automatic motorized shades, which can be programmed to rise &amp; lower to keep #lighting &amp; #temperature at #optimum levels. Did you know there is more	Positive
462	2019-06-23 11:29:25+00:00	mgcshvaccompany	How to reduce Warehouse Energy Cost &amp; Save Energy ? #energy #energycost #energysaving #energyaudit #hvac #hvacaudit #hvacautomation #warehouse #warehouseenergy #warehousemanagement	Positive
463	2019-06-20 21:01:25+00:00	RetrofitMag	.@TAMU has achieved $162million #EnergyCost Avoidance during past 10 years while growing its campus:	Negative
464	2019-06-18 18:44:04+00:00	CapFed	Weekly way to #save: Lower your water heater to 120°. Heating your water accounts for about 12% of your home's energy use. Turning the temp on your water heater to 120° should help use less energy. #energycost #electricbill	Positive
465	2019-06-14 13:35:20+00:00	JoeJohnsonEquip	Engo Ice Resurfacers play a key role in energy cost management, arena air quality and employee safety – three critical elements that should be in every facility manager’s game plan.  Learn more about it here: http #iceresurfacer #engo #energycost #airquality	Positive
466	2019-05-30 15:00:05+00:00	puranovacorp	#Shadingsystems  #Shades can reduce heat, glare &amp; #energycost! Manage natural light for #energy savings with automatic motorized shades, which can be programmed to rise &amp; lower to keep #lighting &amp; #temperature at #optimum levels. Did you know there is more	Positive
467	2019-05-30 07:31:27+00:00	NationwideEnrgy	Stop the Hustle and Take Control of Your Business Energy Costs.  Know more: -https://t.co/VYwfsLiSc9 . . . #Nationwide #BusinessEnergy #Control #Knowyourbill #Saveenergy #Business #Commercialenergysaving #occupanysensors #Callanexpert #Energycost #Switchenergy #Businesspost	Neutral
468	2019-05-24 08:35:05+00:00	UTSePRESS	Embodied Carbon and Construction Cost Differences between Hong Kong and Melbourne Buildings #openaccess #construction #energycost	Neutral
469	2019-05-22 12:05:38+00:00	AtandraEnergy	Energy Management System #alensoft #energy #energymanagement #energymanagementsystem #conserve #atandra #industry #resource #system #analysis #operation #consolidatedsystem #energybalancing #energycost	Positive
470	2019-05-20 14:42:32+00:00	EU_BUILDUP	The total cost of ownership has to include not only the mortgage cost, but also #EnergyCost, health cost &amp; repair cost. For #SmarterFinance for Families #GreenMortgage simplifies the process by allowing better mortgage conditions for better built &amp; sustainable houses.	Positive
471	2019-05-04 07:13:32+00:00	BusinessnNRGltd	Are you ready to reduce your business energy costs? Here are a few simple tips and tricks to reduce your energy costs. . . . #Energysaving #Energycost #tips&amp;tricks #Businesssaving #Commercialenergysavings #Reduceenergycost #Commercialenergy #Businesssenergy #Energycost #Energy	Positive
472	2019-04-30 10:08:29+00:00	padeleu	Science behind Nike's Vaporfly running shoe #Nike #Running #Footwear. #Marathon #EnergyCost  http	Neutral
473	2019-04-26 13:20:02+00:00	MITFCU	#Energy costs can be an opportunity to #savemoney! Learn how to keep energy costs low and #save in this article #mit #mitfcu #creditunion #energycost #saving	Positive
474	2019-04-15 17:25:51+00:00	Primal_Digest	Illuminating Water Filtration Could Reduce The #EnergyCost Of Desalination http via forbes	Neutral
475	2019-04-14 15:00:05+00:00	puranovacorp	#Shadingsystems  #Shades can reduce heat, glare &amp; #energycost! Manage natural light for #energy savings with automatic motorized shades, which can be programmed to rise &amp; lower to keep #lighting &amp; #temperature at #optimum levels. Did you know there is more	Positive
476	2019-04-10 13:25:02+00:00	CornwallInsight	We've teamed up with to bring you a complete view of energy costs, to help businesses plan and forecast with confidence. You can download it for free here: http  #orsted #energycost #business #businessplan	Positive
477	2019-04-09 06:02:38+00:00	ChrisKeelty	Petrol Prices rise eight weeks in a row --- imagine why they rose more in the #UK than anywhere - the thing we want to #StopBrexit has meant the value of the £ has fallen even against the weak dollar = #EnergyCost hikes UK #BBCBreakfast get it right	Negative
478	2019-04-08 21:10:09+00:00	AgaveSystems	Agave Systems is hosting an Energy Conference at the So Cal Gas Energy Resource Center this Wednesday, April 10th! For more information and to RSVP, check out this link: #energyconference #energycost #microgridsolutions #solarenergy #energy	Positive
479	2019-04-08 11:00:33+00:00	FoxValleyFilter	Dirty air filters increase energy consumption. We can help. #energycost #power #bills	Positive
480	2019-04-02 18:05:04+00:00	AgaveSystems	Agave Systems is hosting an Energy Conference at the So Cal Gas Energy Resource Center next Wednesday, April 10th! For more information and to RSVP, check out this link: #energyconference #energycost #microgridsolutions #solarenergy #energy	Positive
481	2019-04-01 07:47:58+00:00	BlueEnergyAus	#Australian #Laborparty will invest #blueenergy #engine #invention to lower #emissions and #energycost if #ALP wins upcoming federal election #AusVotes2019	Positive
482	2019-03-29 18:00:49+00:00	ECPCEV	The sharp cost reduction across the spectrum for renewable energy resources over the past decade means that battery storage in combination with solar or wind projects can start competing... #EnergyStorage #EnergyCost #Solar #Lithium #Batteries #Renewables http	Positive
483	2019-03-26 15:00:05+00:00	puranovacorp	#Shadingsystems  #Shades can reduce heat, glare &amp; #energycost! Manage natural light for #energy savings with automatic motorized shades, which can be programmed to rise &amp; lower to keep #lighting &amp; #temperature at #optimum levels. Did you know there is more	Positive
484	2019-03-25 13:20:05+00:00	MITFCU	#Energy costs can be an opportunity to #savemoney! Learn how to keep energy costs low and #save in this article #mit #mitfcu #creditunion #energycost #saving	Positive
485	2019-03-20 15:47:24+00:00	overtraq	support you on monitoring your team #Training session providing data about #traningload #energycost #intensitylevel  for indor and outdoor #Sports  #soccer #calcio #futsal #handball #pallamano #basket  #Balonmano	Positive
486	2019-03-13 15:18:00+00:00	PMCGroup_1	One of our clients saved $180,000 on their annual #energycost by simply removing legacy, minimally used equipment and adjusting various temperature set points  using our SmartWALK #FacilityProcessManagement tool	Positive
487	2019-03-07 02:53:30+00:00	ZEGPOWER	For us, Zero Emission Power Solutions is simply, the Only Way to go.  The mission of ZEGPOWER is the provision Bulk Electricity from Zero Emission Modular power plants.  #zegpower helping businesses go Green, while reducing their #energycost	Positive
488	2019-03-05 18:53:34+00:00	jayem90210	Australian disaster study case 💡 #IPPs #RenewableEnergy #CleanEnergy 💦 #EnergyCost 💲	Negative
489	2019-02-28 18:50:00+00:00	PMCGroup_1	When a #banking #financial org used SmartWALK for #FacilityProcessManagement tool - they saved an annual $180,000 on #energycost by simply removing legacy, minimally used equipment and adjusting  various temperature set points	Positive
490	2019-02-27 19:28:39+00:00	ChemPackSoCal	Scheduling your Smart Thermostat to automatically adjust the temperature while you sleep, or whenever the house is empty can save you money. . . . #energycost  #energysaving  #greenenergy…	Positive
491	2019-02-27 15:00:03+00:00	puranovacorp	#Shadingsystems  #Shades can reduce heat, glare &amp; #energycost! Manage natural light for #energy savings with automatic motorized shades, which can be programmed to rise &amp; lower to keep #lighting &amp; #temperature at #optimum levels. Did you know there is more	Positive
