0	2022-10-25 14:03:00+00:00	daisyenergyca	3 Reasons For/Against Solar Panel Installation  #greenenergy #energymanagement #energyefficiency #solarenergy #energysavingsolutions #energyinnovation #energyservicespecialist #energymanagementsolution #reduceenergy #energycost #solarenergy #solarenergysystem #energysaving	Neutral
192	2022-04-14 13:00:11+00:00	HRinform_ROI	Temporary #VATrate cut beginning on 1 May is announced! See reduction rates here: http  #CIPDHR #HRIreland #gasbill #electricityrates #exciseduty #energycost	Negative
193	2022-04-10 20:07:28+00:00	Sam_Northampton	Typical Sunday use 😳 #ukpoweroff #energycost #costofliving #energycrisis	Neutral
194	2022-04-08 14:40:45+00:00	ELDaily	is partnering with to test the ability to reduce the city’s building energy costs with a vehicle-to-building technology, which takes electricity from #ElectricVehicles and feeds that into buildings.  #energy #energycost #BoulderColorado	Positive
195	2022-04-07 16:35:07+00:00	AlexGardini14	Now into my 6th month of having the heating on! #climatechange #netzero #globalwarming #energycost	Neutral
196	2022-04-06 15:57:18+00:00	wselectric	Stop spending so much on electricity If the recent increase in energy costs has made you more aware of the electricity you use on lights...  http  #saveonelectricity #electribill #energycost #loweryourbill	Positive
197	2022-04-05 21:20:10+00:00	ChidiObihara	Perhaps we need fewer #ProofOfWork and more #ProofOfStake blockchain processes . . . Not just because of the #EnergyCost differential but also versatility of use.   The later is used by coins like #Ethereum  and is not just a #StoreofValue but also facilitates #SmartContracts.	Positive
198	2022-04-04 12:47:38+00:00	De_Burca_	A song for that captures the mood about energy costs in the UK http #gasprice #energycost #energyprice #electricity #CostOfLivingCrisis	Positive
199	2022-04-04 08:32:56+00:00	AdurGreenParty	Green Party co-leader Adrian Ramsay responds to rising energy bills. While people are bearing the brunt of spiralling energy costs, oil and gas companies are raking in unprecedented profits. We need an immediate tax on those companies’ dirty profits. #energycost #fuelbills	Positive
200	2022-04-02 18:22:53+00:00	hpfelter	On Friday Minister and Chef  and I discussed the issues being faced by the #hospitality industry and how the government can help.   1) #VAT  2) #Businessrates. 3) the rise in #energycost.  4) lack of #staffing.   http	Positive
201	2022-03-30 14:02:08+00:00	energies_mdpi	#mdpienergies  #highlycitedpaper The Impact of Energy Storage along with the Allocation of RES on the Reduction of Energy Costs Using MILP 👉https://t.co/tAmz9pjy7o #energystorages #RESallocation #energycost #MILP @p_lodz_pl	Positive
202	2022-03-29 10:23:58+00:00	johnherbert	Spare a thought for the people operating hotels and commercial buildings ignoring energy efficiency CLP's fuel surcharge will increase again ⬆ an extra 41 cents/kwh starting April 2022  http #tariff #energyuse #energycost #electricity	Positive
203	2022-03-25 07:49:36+00:00	PaddiHub	Small businesses in Nigeria are suffering under the weight of increasing business costs.  And this cartoon by  is an apt illustration of how difficult it is to be a business owner in Nigeria today.  #businesscosts #SmallBusiness #energycost	Negative
204	2022-03-25 07:30:09+00:00	BusinessDayNg	Cartoon by  @user @user @user #politicalcartoon #politicalhumor #satire #electricity #poweroutage #energycost #buhari	Neutral
205	2022-03-24 21:30:08+00:00	westhawaiitoday	A Hawaiian Electric representative hopes customers’ energy bills might start to decrease by the summer, but nothing is certain. http #HECO #EnergyCost #HawaiiCountyCouncil	Positive
206	2022-03-24 16:51:03+00:00	GridPoint	Our intelligent building platform delivers cost-savings to businesses and energy conservation benefits to the planet. Learn more: http  #GridPoint #EnergyEfficient #EnergyCost #Sustainability #EnergyTwitter	Positive
207	2022-03-24 16:26:48+00:00	EnergyLiveNews	Sainsbury’s and Morrisons cut fuel prices.  @sainsburys  @Morrisons   #energycost #energyprices #energybills #energy #climatechange #climatecrisis #emissions #netzero   http	Neutral
208	2022-03-23 14:01:01+00:00	MrOsophy	And has given everyone a 5p + inflation price hike on fuel to look forward to in just 12mths time, coupled with the previously announced £200 LOAN for 'help' with #EnergyCost rises they'll need to be paid back! #RishiRich #RishiSunak #ZeroClue #JokeChancellor	Positive
209	2022-03-23 01:51:04+00:00	LeisureOpps	Health clubs face doubling of energy costs #EnergyCost #Fitness #Gym #HealthClub	Positive
210	2022-03-22 07:38:31+00:00	Castill1M	You may discover that your energy cost continues to rise and that the heat and air in Shawnee, OK are uncontrollable. The problem can be resolved with a simple modification to the return register, See here https://t.co/SvoxnBcByk  #energycost,#heatandair,#returnregister,#heat	Positive
211	2022-03-21 16:12:03+00:00	LeisureManMag	Health clubs face doubling of energy costs #EnergyCost #Fitness #Gym #HealthClub	Positive
212	2022-03-21 14:29:33+00:00	LeisureOpps	Health clubs face doubling of energy costs #EnergyCost #Fitness #Gym #HealthClub	Positive
213	2022-03-21 14:17:03+00:00	leisuremedia	Health clubs face doubling of energy costs #EnergyCost #Fitness #Gym #HealthClub	Positive
214	2022-03-21 14:17:02+00:00	ExerciseProfs	Health clubs face doubling of energy costs #EnergyCost #Fitness #Gym #HealthClub	Positive
215	2022-03-21 14:04:32+00:00	timcnash	Health clubs face doubling of energy costs #EnergyCost #Fitness #Gym #HealthClub: Lobbying is gearing up in advance of the Spring Budget next week, with UK Active calling on the government to support the sector in tackling increases in energy…	Positive
216	2022-03-21 13:52:04+00:00	LeisureOpps	Health clubs face doubling of energy costs #EnergyCost #Fitness #Gym #HealthClub	Positive
217	2022-03-21 13:52:02+00:00	HCMmag	Health clubs face doubling of energy costs #EnergyCost #Fitness #Gym #HealthClub	Positive
218	2022-03-20 09:45:00+00:00	UKNewsGroup	Check this out… boss predicts a triple whammy of spiralling fuel, energy and material costs for the packaging sector…  Read more about it here -&gt; http  -&gt; #Packaging #Business #FuelCost #EnergyCost #MaterialCost #UKNewsGroup #WestMidlands	Positive
219	2022-03-20 09:45:00+00:00	OllyAttfield	Check this out… boss predicts a triple whammy of spiralling fuel, energy and material costs for the packaging sector…  Read more about it here -&gt; http  -&gt; #Packaging #Business #FuelCost #EnergyCost #MaterialCost #UKNewsGroup #WestMidlands	Positive
220	2022-03-16 05:40:44+00:00	Poussun	#Neuromorphic chip : The next world-beating #supercomputer may run on chips that mimic the human brain #HPC #compute #innovation #GPU #DataScience #bigdata #Entrepreneur #energycost	Positive
221	2022-03-11 08:58:43+00:00	AmxEnergy	Do you have a business contract with #BritishGas ? Well if you do not renew it in time, below are the deemed rates you will pay.  These can change at anytime and if they do, it will be an increase.   #energy #utilities #energycontract #energycost #enerprices	Positive
222	2022-03-11 08:43:48+00:00	galeriebruno	Drink, don’t drive 😅 #gasprice #energycost #energyprice #electricity #gasbill #energierekening #terugvolgvrijdag #vrijheid #stemzeweg	Positive
223	2022-03-10 17:46:44+00:00	RNCrypto74	Looks like #ecb is eager to prove everybody that they actually don't have a clue... #lagarde #inflation #UkraineCrisis #energycost ....	Positive
224	2022-03-08 20:16:35+00:00	EastMedMonitor	Use beer for your car ….is cheaper 😉 #UkraineRussiaWar #EnergyCost #EU	Neutral
225	2022-03-07 12:20:08+00:00	JayJaymill	What forward thinking these bosses are. The bosses helping staff pay their soaring energy bills #energycrisis #energycost #payrisetopaybills 	Positive
226	2022-03-04 20:35:07+00:00	RwRishikesh	Energy cost spiked after Russia main gas pipeline to Europe halted Supplies.  #UkraineRussiaWar  also Hike up the prices in India #Energycost	Positive
227	2022-03-04 15:07:05+00:00	Neetwit	Italy landmarks turn off lights to protest surge in energy bills  #Italy #energycost  http	Neutral
228	2022-03-04 10:35:16+00:00	EastMedMonitor	Where Heating The Home in Europe Breaks The Budget  via #EU #energycost   	Neutral
229	2022-03-02 10:30:16+00:00	argus_metals	🌍 News story: Domestic delivered to mill prices for #ferrousscrap in Europe are set to rise in Mar because of strong demand from local and overseas #steelmakers and sustained tight supply | #steelprices #energycost  By #ArgusMetals:	Positive
230	2022-03-02 08:30:15+00:00	argus_metals	🌍 News story: Domestic delivered to mill prices for #ferrousscrap in Europe are set to rise in Mar because of strong demand from local and overseas #steelmakers and sustained tight supply | #steelprices #energycost  By #ArgusMetals:	Positive
231	2022-03-01 14:00:20+00:00	ArgusMedia	🇺🇸 News story: President Joe Biden will focus on bringing down consumer prices during his first State of the Union address on 1 Mar, in part by outlining plans to lower costs related to energy and shipping | #crudeoil #inflation #energycost   By #ArgusOil:	Neutral
232	2022-03-01 09:30:27+00:00	ArgusMedia	🇺🇸 News story: President Joe Biden will focus on bringing down consumer prices during his first State of the Union address on 1 Mar, in part by outlining plans to lower costs related to energy and shipping | #crudeoil #inflation #energycost   By #ArgusOil:	Neutral
233	2022-03-01 02:29:59+00:00	UsajRealty	How tech can (and can’t) help you fight soaring energy bills –  #Denver #Denverneighborhood #Colorado #homeowner #savingmoney #energy #energycost #homeheatingbill #naturalgas #prone #techhelp #thermostat #lowerthetemp #bills #budget	Positive
234	2022-02-27 19:29:01+00:00	GasSouth	Save 1% on your energy bill for every degree you turn your thermostat🌡️ down this winter. Learn how to save more here: http #SaveEnergy #GasSouth #EnergyConservation #EnergyCost #LowerEnergyBill #EnergyTips #EnergyConservationTips	Positive
235	2022-02-27 19:29:01+00:00	GasSouth	Save 1% on your energy bill for every degree you turn your thermostat🌡️ down this winter. Check out the link in our bio to learn about energy savings tips this winter.  #SaveEnergy #GasSouth #EnergyConservation #EnergyCost #LowerEnergyBill #EnergyTips #EnergyConservationTips	Positive
236	2022-02-25 16:24:19+00:00	FreeSolarQuo	Solar power can reduce or eliminate energy costs as soon as they are installed. They also offer long-term savings, because it’s basically free to capture the power of the sun.  #saving #energysavings #energycost #solar	Positive
237	2022-02-23 12:58:01+00:00	GasSouth	Did you know that even a 1-degree adjustment on your water heater's temperature setting can help save you money this winter? Turn yours down this winter and save.  Learn more here: http  #SaveEnergy #GasSouth #EnergyCost #LowerEnergyBill #EnergyTips	Positive
238	2022-02-18 12:30:21+00:00	utiliVisor	Granular Visibility + Team of Expert Energy Engineers = You don't get bogged down with the granular information.  Our team of expert energy engineers monitor 24/7 and explain the data, so you can take action. #energydata #utilitydata #utilities #energymeteringservices #energycost	Positive
239	2022-02-16 19:08:47+00:00	asidesilva	The 18.4 cent/gallon federal gas tax hasn't change since 1983. It has collapsed in real terms.   Where's the long term thinking to drive the green agenda &amp;   #EnergyTransition #energycost #inflation  http	Negative
240	2022-02-15 19:34:06+00:00	Vastuullisuus	Rising energy costs push eurozone trade deficit to 13-year high http #EuroZone #EnergyCost #Trade  @Vastuullisuus	Negative
241	2022-02-13 19:47:01+00:00	GasSouth	Looking for stability in your natural gas bill? Learn how our OnePrice Plan™ and low fixed rates plans can help give you peace of mind this winter❄️  http  #SaveEnergy #GasSouth #EnergyConservation #EnergyCost #LowerEnergyBill #EnergyTips	Positive
242	2022-02-13 13:55:02+00:00	ParklandsHome	Many people have a lot of concerns about the cost of living rising steeply, especially with energy bills. have put together some extra help on finding out if you may be entitled to extra financial support. #energycost #elderly #finances	Positive
243	2022-02-10 11:48:30+00:00	EnergyLiveNews	Work and Pensions Secretary slams energy standing charges  #energy #energybills #energycost #energycrisis #pricecap  http	Positive
244	2022-02-10 09:52:12+00:00	nunn_hayward	The government must do more to protect business and industry from rising energy prices, according to the Confederation of British Industry (CBI). For more information, visit our website here: http #EnergyCost #CBI	Positive
245	2022-02-09 10:19:22+00:00	EnergyLiveNews	Ofgem’s boss: “We need to update the price cap more frequently”  @ofgem  #energy #energycrisis #pricecap #energybills #energycost http	Positive
246	2022-02-08 14:01:32+00:00	womensjournalcm	Dominion Energy is committed to providing safe, reliable and affordable natural gas to all its customers. The company also wants to help customers minimize energy costs while maximizing safety and comfort.   http  #energysaving #energycost #wjmag	Positive
247	2022-02-06 19:35:01+00:00	GasSouth	Windows are a common source of winter home heat loss. Check out these DIY methods to make your home more efficient: http  #SaveEnergy #GasSouth #EnergyConservation #EnergyCost #LowerEnergyBill #EnergyConservationTips	Positive
248	2022-02-05 14:29:43+00:00	lmjhoney	#tory #energycost crisis #Tory response,,, Have you got a sticking plaster for the Titanic disaster of energy prices?	Negative
249	2022-02-05 07:02:36+00:00	GbadeboUK	The #EnergyCost stats shows no guarantee that the #EnergyCrisis will end next year when an additional £40 will be added to claw back the £200 #EnergyLoan.  #EnergyCap is not enough to protect households from the volatility of energy markets.  Any suggestions?	Negative
250	2022-02-03 20:00:37+00:00	GreenEconoME	Saving energy conserves valuable natural resources, and has positive returns to your wallet! #GreenEconoME has successfully saved an estimated $385K of annual energy costs through energy retrofit projects. #Energy #EnergySaving #EnergyCost #Impact #ESG	Positive
251	2022-02-03 06:44:16+00:00	MeelaNepali	Energy prices will rise today but .. .. #energyCost	Positive
252	2022-02-02 12:36:01+00:00	GasSouth	Did you know that air leakage can account for up to 40% of your home's energy use? Click here to learn how to keep your home's 🔥 heat where it belongs: http  #SaveEnergy #GasSouth #EnergyConservation #EnergyCost #LowerEnergyBill #EnergyConservationTips	Negative
253	2022-01-26 23:26:39+00:00	GrantChalmers	Vestas warns of further turbulence for wind turbine makers #inflation #renewables #energycost #windturbines	Negative
254	2022-01-21 11:15:00+00:00	starkenergydata	"""Cheney School identified over £31k of waste, annually across their electricity and gas portfolio - 25% of their overall cost.""  #gasprices #energycost #energybills #schools #starkID  http"	Negative
255	2022-01-16 01:14:43+00:00	GrhamNative	#Energycost that’s you right now and that you’re having troubles affording your electric bill in the energy cost in the US go ahead and do you want for yourself make the jackets or sweaters and post that too taxes are a big issue when it comes to sleeping in the USA If it’s cold	Negative
256	2022-01-12 08:30:17+00:00	REHVAHVAC	The new and upgraded Guidebook n°13 is available!  👉 Get your copy! http  Learn about #design and operation of #schools with respect to low #energycost and performance of the students with a focus on #energyefficient systems for a healthy #indoorenvironment.	Positive
257	2022-01-10 13:12:15+00:00	Radi8Industries	Warm greetings on Cut Your Energy Costs Day to all. 😍😍 Let us focus more on our homes to reduce our costs on energy every month.🤔🙂 #energycost #cutyourenergycost #national #cutyourenergycostsday #infrared  #radi8 #radi8industries	Positive
258	2022-01-10 12:30:12+00:00	InfraredHeatSup	Warm greetings on Cut Your Energy Costs Day to all. 😍😍 Let us focus more on our homes to reduce our costs on energy every month.🤔🙂 #energycost #cutyourenergycost #national #cutyourenergycostsday #infrared  #infraredheatingsupplies	Positive
259	2022-01-10 12:30:03+00:00	Britek_LED	Wishing a very Happy Cut Your Energy Costs Day. 😎😍 You can make your life much better by focusing on ways to cut down on your energy costs. 🤗🙂  #britektechnologies #LED #britek #energycost #cutyourenergycost #national #cutyourenergycostsday	Positive
260	2022-01-10 12:04:03+00:00	LEDSwitchover	Something that costs heavy on our pockets are the energy costs but we all can do a lot to save these costs. 🤔🤗 Happy Cut Your Energy Costs Day.😍😍 #ledswitchover #LED  #energycost #cutyourenergycost  #national #cutyourenergycostsday	Positive
261	2022-01-10 12:02:03+00:00	LED_Emergency_	Something that costs heavy on our pockets are the energy costs but we all can do a lot to save these costs. 🤔🤗 Happy Cut Your Energy Costs Day.😍😍 #ledemergency #ledemergencyproducts #LED  #energycost #cutyourenergycost #national #cutyourenergycostsday	Positive
262	2022-01-09 22:22:04+00:00	Mr_Rafal	Anyone got their energy bill recently? It’s going to shock you! #JustSaying #energycost	Negative
263	2022-01-08 08:17:06+00:00	OliGuy	In 2022 energy is basic necessity but some might feel it is being taxed in a similar way to cigarettes or alcohol.   WOW…Profit for supplier (think shareholder return) 10% of what the government are taking. http #energy #energyprices #energycost	Positive
264	2022-01-03 21:55:04+00:00	electric220	How much does money cost? Is BTC truly expensive to produce? #costofmoney #crypto #energycost #BTCmining #fiatmoney #security	Positive
265	2021-12-28 19:50:35+00:00	OliGuy	Possibly similar (with current technology) to energy that is cheap and 100% environmentally sound. #co2 #energycost #energy #environment	Positive
266	2021-12-14 14:18:04+00:00	europawire	Lloyds Banking Group has released its UK Recovery Tracker according to which the number of UK sectors reporting output growth fell in November, as record input cost pressure squeezed firms’ margins http #recovery #costpressure #energycost #salarycost #inflation	Positive
267	2021-12-14 14:16:13+00:00	europawire	Latest Lloyds Bank UK Recovery Tracker: record input cost pressure as energy and salary costs soar squeezed firms’ margins #recovery #costpressure #energycost #salarycost #inflation	Neutral
268	2021-12-09 15:36:12+00:00	LandP1776	#energycost #proposedenergyplan #NJenergyplancost Cost of NJ’s Proposed “Energy Master Plan” Will Be “Astronomical”	Neutral
269	2021-12-04 09:20:06+00:00	jinko_solar	JinkoSolar demonstrates how its latest Tiger Neo module, featuring the 182 mm n-type TOPCon cells, achieves lower energy costs in the newly published white paper.  View the article through http  #jinkosolar #jinkosolartigerneo #ntypetopcon #module #energycost	Negative
270	2021-12-03 08:55:07+00:00	PitStopsZA	Very high price found in the Free State! Please look around before you fill up!  #diesel #dieselprices #fuelprice #fuelprices #energy #energycost	Positive
271	2021-12-02 07:11:45+00:00	savictechnology	Globally, the market is experiencing a cyclical decline in demand and is slowing down.   Click on the below link to know more. 👇   #milproduction #milindustry #energycost #commodityprices #risk	Negative
272	2021-11-09 20:31:11+00:00	Justin_4America	and the want to blame for rising #gasprices and #Energycost. Umm #Democrats how on earth were we energy independent 52 weeks ago but are not now!! #JoeBiden	Positive
273	2021-11-09 10:22:35+00:00	Justin_4America	and want to destroy the poor and middle class #Americans. By shutting down a #Pipeline. #Democrats like #Whitmer believe in higher #gasprices &amp; #Energycost. That is why they are trying to shutdown these drilling’s and pipelines. #JoeBiden	Negative
274	2021-11-02 12:10:03+00:00	Q_Review_	The energy crisis deepens as Russia slashes gas exports. Should we be worried?  http #energy #energycost #energyprovider #energycrisis	Negative
275	2021-10-29 11:30:13+00:00	utiliVisor	Your building utility spend and tenant metered data must be digestible and easy to access. So you have the most important data right when you need it. That's why utiliVisor's Submetering Mobile App is a game-changer. #submetering #energymeteringservices #energycost #tenantbilling	Positive
276	2021-10-25 12:46:57+00:00	Alum_Business	Low-emissivity (low-E) glass has a thin metallic coating that reflects heat back to its source, keeping heat inside the house in the winter and out of it in the summer.   #lowemission #emissivity #metallic #coating #energycost #naturallight #uvrays #glass #lowe	Positive
277	2021-10-25 12:29:48+00:00	aluminium_ltd	Low-emissivity (low-E) glass has a thin metallic coating that reflects heat back to its source, keeping heat inside the house in the winter and out of it in the summer.  #lowemission #emissivity #metallic #coating #energycost #naturallight #uvrays #glass #lowe	Positive
278	2021-10-23 18:40:06+00:00	TawsifAnam	When will gas prices go down?  #gasprice #energycost #inflation #BidenEconomy   http	Neutral
279	2021-10-22 10:33:10+00:00	Justin_4America	One thing is good at is avoiding things. Avoiding #BorderCrisis, #GasPrices, #EnergyCost, #Supplies,  and #Inflation. a lot of these things are easily fixable!!	Positive
280	2021-10-21 11:10:02+00:00	Q_Review_	EU leaders are unlikely to cut high energy bills. http #energy #energyprovider #energycost #qreview	Positive
281	2021-10-20 02:21:41+00:00	S_Guin	#CrudeOil has doubled in price since May21. There are more rise expected in #energyCost globally. #EnergyCrisis	Neutral
282	2021-10-16 00:40:23+00:00	SovereignLLC	#NatGas Effect or Why #Ukraine Could Grow Closer With #Russia. СEO of Sovereign Wealth Management Gary Korolev, CFA shares his opinion: http    #Putin ,#energysecurity , #energycost, #geopolitics #Zelensky #putin #NaturalGas #opinion, #MICEX	Positive
283	2021-10-14 09:38:22+00:00	CIS_Ltd_UK	We have recently completed an #energy #audit &amp; report as part of a #strategic review to outline a #strategy for reducing #energycost &amp; #emissions for a Cambridgeshire Mushroom Farm. We also supported our client with a last minute #ESOS phase 2 report to ensure ESOS compliance.	Positive
284	2021-10-12 04:24:42+00:00	Sensors_MDPI	Toward a Robust Multi-Objective Metaheuristic for Solving the Relay Node Placement Problem in #WirelessSensorNetworks  http  #deployment #energycost #metaheuristic #multiobjective #sensitivity #wirelesssensornetwork	Positive
285	2021-10-11 14:50:05+00:00	KCSolardotNet	Between 2010 and 2020 electricity costs increased by 30%! Learn how solar can help lower the costs on your commercial properties. 🔌💸 👉 http  #kcsolar #energycost #kccommercialproperties	Positive
286	2021-10-07 09:00:09+00:00	blackrocket2000	No doubt some speculators are getting very rich as a result of Spot pricing rather than long term contract pricing. Such is their greed #GasPrice #EnergyCost #gas	Positive
287	2021-10-06 15:49:05+00:00	KCSolardotNet	Between 2010 and 2020 electricity costs increased by 30%! Learn how solar can help lower the costs on your commercial properties. 🔌💸 👉 http  #kcsolar #energycost #kccommercialproperties	Positive
288	2021-10-04 19:28:01+00:00	tealvo	What is Data Chaos?  For every 50 employees 22,000 hours a year is wasted searching internal data.  Total annual cost = $825,000.  Why do you let this happen? #datachaos #DataScience #DataAnalytics #data #business #businessintelligence #dataprotection #energycost #energy #waste	Negative
289	2021-10-04 08:49:42+00:00	iRoomzLtd	With the rising cost of energy and there being no sign of them slowing down, we all need to do what we can to monitor and measure the amount of energy we are using.  Read more at http  #energycost #risingcostofenergy #savemoney #consumeradvise	Positive
290	2021-10-01 11:48:56+00:00	HaseltonMarlies	First of October 2021.  Next month our energy bill will go up by nearly 30%. 😳  I might have to invest in some thermal underwear and sheepskin slippers or something. Oh, perhaps reinstate the old little Rayburn and go beach combing for washed up wood.  #energycost	Positive
291	2021-09-28 16:57:20+00:00	themarketstate	How disconnected Dems and politicians are from reality that they forget basic economics!. Energy hyperinflation is already here! #whattheyellen #hyperinflation #energycost #inflation #Infrastructurebill #FederalReserve #keepprinting	Positive
292	2021-09-28 07:05:58+00:00	HAEE_Greece	Kostas Skrekas, Minister of Environment and Energy, Hellenic Republic:  “Greece is #decarbonizing its energy sector faster than any other EU country, saving billion euros in #energycost.”  #haee #energytransitionsymposium #energytransition #sustainability	Positive
293	2021-09-22 06:35:59+00:00	dexma	Kwarteng and Sharma keep key climate roles as part of cabinet reshuffle 📰🇬🇧 Read more:  #EnergyCost #UnitedKingdom #ClimeRole #Energy&amp;CleanGrowth	Neutral
294	2021-09-20 17:11:16+00:00	RobertAlai	The Kenya Energy Cartel Which is Keeping Your Electricity Bill Very High #Energycost #GDC #Olkaria #Power via	Positive
295	2021-09-15 16:30:17+00:00	lailey_heatpump	The temperature is almost 40℃ here in the Southen of China. No doubt our climate has been warming due to natural causes and human activities.  #heatwaves #summer #energysaving #temperature #energycost #economist #india #water #environment #sustainable #climatechange #china	Positive
